<?xml version="1.0" encoding="UTF-8"?>
<!DOCTYPE classmap PUBLIC "-//JAFFA//DTD JDBC Engine Mapping 1.0//EN" "http://jaffa.sourceforge.net/DTD/jdbc-engine-mapping_1_0.dtd">

<classmap>
    <class name="org.jaffa.persistence.domainobjects.IPart">
        <map-to table="ZZ_JUT_PART" />

        <field name="Part" type="java.lang.String" primary-key="true">
            <sql name="PART" type="STRING" dirty="ignore"/>
        </field>

        <field name="Noun" type="java.lang.String">
            <sql name="NOUN" type="STRING" dirty="ignore"/>
        </field>

        <field name="CategoryInstrument" type="java.lang.String">
            <sql name="CATEGORY_INSTRUMENT" type="STRING" dirty="ignore"/>
        </field>

    </class>
</classmap>